Name,AI custom autofill,Published,Tags
The Art of Living in the Moment,The blog explores the transformative power of mindfulness in daily life.,"December 7, 2023","Mental Health, Mindfulness"
My Top 10 Books and Why I Love Them,Discover my top 10 favorite books and the profound impact they've had on me.,"October 11, 2023","Books, Learning"
Exploring New Cuisines,Exploring New Cuisines: A Culinary Adventure Through Diverse Flavors and Cultures.,"August 22, 2023","Food, Travel"
The Power of Positive Thinking,This blog post explores the transformative power and psychological benefits of positive thinking.,"June 9, 2023","Lifestyle, Psychology"
My Favorite Hobbies: How I Spend My Free Time,"My Favorite Hobbies: How I Spend My Free Time - Exploring joy, relaxation, and personal growth through reading, gardening, and cooking.",,"Hobbies, Lifestyle"